"module","modSize","bkgrModSize","rank","enrichmentP","BonferoniP","nModGenesInTerm","fracOfBkgrModSize","fracOfBkgrTermSize","bkgrTermSize","termID","termOntology","termName","termDefinition"
"cyan",141,138,20,0.00258340957613158,1,3,0.0217391304347826,0.111111111111111,27,"GO:0046470","BP","phosphatidylcholine metabolic process","The chemical reactions and pathways involving phosphatidylcholines, any of a class of glycerophospholipids in which the phosphatidyl group is esterified to the hydroxyl group of choline. They are important constituents of cell membranes."
"darkred",50,50,1,4.919796131369e-17,8.28592064445167e-13,11,0.22,0.203703703703704,54,"GO:0006635","BP","fatty acid beta-oxidation","A fatty acid oxidation process that results in the complete oxidation of a long-chain fatty acid. Fatty acid beta-oxidation begins with the addition of coenzyme A to a fatty acid, and occurs by successive cycles of reactions during each of which the fatty acid is shortened by a two-carbon fragment removed as acetyl coenzyme A; the cycle continues until only two or three carbons remain (as acetyl-CoA or propionyl-CoA respectively)."
"darkred",50,50,2,6.11362494975704e-17,1.02965671403808e-12,12,0.24,0.153846153846154,78,"GO:0019395","BP","fatty acid oxidation","The removal of one or more electrons from a fatty acid, with or without the concomitant removal of a proton or protons, by reaction with an electron-accepting substance, by addition of oxygen or by removal of hydrogen."
"darkred",50,50,3,7.18971405633697e-17,1.21089164136827e-12,12,0.24,0.151898734177215,79,"GO:0034440","BP","lipid oxidation","The removal of one or more electrons from a lipid, with or without the concomitant removal of a proton or protons, by reaction with an electron-accepting substance, by addition of oxygen or by removal of hydrogen."
"darkred",50,50,4,7.59013397593027e-16,1.27833036422618e-11,11,0.22,0.161764705882353,68,"GO:0009062","BP","fatty acid catabolic process","The chemical reactions and pathways resulting in the breakdown of a fatty acid, any of the aliphatic monocarboxylic acids that can be liberated by hydrolysis from naturally occurring fats and oils. Fatty acids are predominantly straight-chain acids of 4 to 24 carbon atoms, which may be saturated or unsaturated; branched fatty acids and hydroxy fatty acids also occur, and very long chain acids of over 30 carbons are found in waxes."
"darkred",50,50,5,2.75866431855707e-13,4.64614244531382e-09,12,0.24,0.0779220779220779,154,"GO:0030258","BP","lipid modification","The covalent alteration of one or more fatty acids in a lipid, resulting in a change in the properties of the lipid."
"darkred",50,50,6,9.99802199177264e-13,1.68386686385435e-08,14,0.28,0.05,280,"GO:0006631","BP","fatty acid metabolic process","The chemical reactions and pathways involving fatty acids, aliphatic monocarboxylic acids liberated from naturally occurring fats and oils by hydrolysis."
"darkred",50,50,7,1.79388146983514e-12,3.02125517149635e-08,19,0.38,0.0274170274170274,693,"GO:0044255","BP","cellular lipid metabolic process","The chemical reactions and pathways involving lipids, as carried out by individual cells."
"darkred",50,50,8,3.23710893780627e-12,5.45193887305332e-08,11,0.22,0.0774647887323944,142,"GO:0044242","BP","cellular lipid catabolic process","The chemical reactions and pathways resulting in the breakdown of lipids, as carried out by individual cells."
"darkred",50,50,9,5.49775010186949e-12,9.2593107215686e-08,11,0.22,0.0738255033557047,149,"GO:0046395","BP","carboxylic acid catabolic process","The chemical reactions and pathways resulting in the breakdown of carboxylic acids, any organic acid containing one or more carboxyl (-COOH) groups."
"darkred",50,50,10,9.35850750464054e-12,1.57615983393156e-07,12,0.24,0.0579710144927536,207,"GO:0016042","BP","lipid catabolic process","The chemical reactions and pathways resulting in the breakdown of lipids, compounds soluble in an organic solvent but not, or sparingly, in an aqueous solvent."
"darkred",50,50,11,2.10149733171033e-11,3.53934180606654e-07,20,0.4,0.0220507166482911,907,"GO:0006629","BP","lipid metabolic process","The chemical reactions and pathways involving lipids, compounds soluble in an organic solvent but not, or sparingly, in an aqueous solvent. Includes fatty acids; neutral fats, other fatty-acid esters, and soaps; long-chain (fatty) alcohols and waxes; sphingoids and other long-chain bases; glycolipids, phospholipids and sphingolipids; and carotenes, polyprenols, sterols, terpenes and other isoprenoids."
"darkred",50,50,12,2.79444531614523e-11,4.70640480145179e-07,15,0.3,0.0344827586206897,435,"GO:0032787","BP","monocarboxylic acid metabolic process","The chemical reactions and pathways involving monocarboxylic acids, any organic acid containing one carboxyl (COOH) group or anion (COO-)."
"darkred",50,50,13,7.098153736567e-10,1.19547105231261e-05,17,0.34,0.0226666666666667,750,"GO:0006082","BP","organic acid metabolic process","The chemical reactions and pathways involving organic acids, any acidic compound containing carbon in covalent linkage."
"darkred",50,50,14,1.78984877291534e-09,3.01446330334401e-05,16,0.32,0.0232558139534884,688,"GO:0019752","BP","carboxylic acid metabolic process","The chemical reactions and pathways involving carboxylic acids, any organic acid containing one or more carboxyl (COOH) groups or anions (COO-)."
"darkred",50,50,15,3.65548098961962e-08,0.000615656108271737,21,0.42,0.0136629798308393,1537,"GO:0005739","CC","mitochondrion","A semiautonomous, self replicating organelle that occurs in varying numbers, shapes, and sizes in the cytoplasm of virtually all eukaryotic cells. It is notably the site of tissue respiration."
"darkred",50,50,16,4.51613188049987e-08,0.000760606931313789,15,0.3,0.0201342281879195,745,"GO:0055114","BP","oxidation-reduction process","A metabolic process that results in the removal or addition of one or more electrons to or from a substance, with or without the concomitant removal or addition of a proton or protons."
"darkred",50,50,17,7.69353042373185e-08,0.00129574439396492,5,0.1,0.166666666666667,30,"GO:0000062","MF","fatty-acyl-CoA binding","Interacting selectively and non-covalently with acyl-CoA, any derivative of coenzyme A in which the sulfhydryl group is in thiolester linkage with a fatty acyl group."
"darkred",50,50,18,3.19229763456443e-07,0.00537646767613341,12,0.24,0.0230326295585413,521,"GO:0005740","CC","mitochondrial envelope","The double lipid bilayer enclosing the mitochondrion and separating its contents from the cell cytoplasm; includes the intermembrane space."
"darkred",50,50,19,6.78102722580787e-07,0.0114206060537056,10,0.2,0.0277008310249307,361,"GO:0005743","CC","mitochondrial inner membrane","The inner, i.e. lumen-facing, lipid bilayer of the mitochondrial envelope. It is highly folded to form cristae."
"darkred",50,50,20,1.279375043867e-06,0.021547234488808,11,0.22,0.0226337448559671,486,"GO:0031966","CC","mitochondrial membrane","Either of the lipid bilayers that surround the mitochondrion and form the mitochondrial envelope."
"green",698,684,1,2.08100186903564e-25,3.50482334782982e-21,173,0.252923976608187,0.112556929082629,1537,"GO:0005739","CC","mitochondrion","A semiautonomous, self replicating organelle that occurs in varying numbers, shapes, and sizes in the cytoplasm of virtually all eukaryotic cells. It is notably the site of tissue respiration."
"green",698,684,2,7.43770159100976e-13,1.25265770195786e-08,81,0.118421052631579,0.117732558139535,688,"GO:0019752","BP","carboxylic acid metabolic process","The chemical reactions and pathways involving carboxylic acids, any organic acid containing one or more carboxyl (COOH) groups or anions (COO-)."
"green",698,684,3,9.34833864045397e-13,1.57444719382526e-08,47,0.0687134502923977,0.163194444444444,288,"GO:0051186","BP","cofactor metabolic process","The chemical reactions and pathways involving a cofactor, a substance that is required for the activity of an enzyme or other protein. Cofactors may be inorganic, such as the metal atoms zinc, iron, and copper in certain forms, or organic, in which case they are referred to as coenzymes. Cofactors may either be bound tightly to active sites or bind loosely with the substrate."
"green",698,684,4,4.61346218622085e-12,7.76999301403315e-08,66,0.0964912280701754,0.126679462571977,521,"GO:0005740","CC","mitochondrial envelope","The double lipid bilayer enclosing the mitochondrion and separating its contents from the cell cytoplasm; includes the intermembrane space."
"green",698,684,5,5.33827634591182e-12,8.99072502178468e-08,63,0.0921052631578947,0.12962962962963,486,"GO:0031966","CC","mitochondrial membrane","Either of the lipid bilayers that surround the mitochondrion and form the mitochondrial envelope."
"green",698,684,6,1.03146194260541e-11,1.73718820373603e-07,83,0.121345029239766,0.110666666666667,750,"GO:0006082","BP","organic acid metabolic process","The chemical reactions and pathways involving organic acids, any acidic compound containing carbon in covalent linkage."
"green",698,684,7,2.69909061855907e-11,4.54580841977719e-07,51,0.0745614035087719,0.141274238227147,361,"GO:0005743","CC","mitochondrial inner membrane","The inner, i.e. lumen-facing, lipid bilayer of the mitochondrial envelope. It is highly folded to form cristae."
"green",698,684,8,8.38264738826412e-11,1.41180547313144e-06,303,0.442982456140351,0.0686919065971435,4411,"GO:0003824","MF","catalytic activity","Catalysis of a biochemical reaction at physiological temperatures. In biologically catalyzed reactions, the reactants are known as substrates, and the catalysts are naturally occurring macromolecular substances known as enzymes. Enzymes possess specific binding sites for substrates, and are usually composed wholly or largely of protein, but RNA that has catalytic activity (ribozyme) is often also regarded as enzymatic."
"green",698,684,9,1.96569370063119e-10,3.31062133060305e-06,38,0.0555555555555556,0.161702127659574,235,"GO:0048037","MF","cofactor binding","Interacting selectively and non-covalently with a cofactor, a substance that is required for the activity of an enzyme or other protein. Cofactors may be inorganic, such as the metal atoms zinc, iron, and copper in certain forms, or organic, in which case they are referred to as coenzymes. Cofactors may either be bound tightly to active sites or bind loosely with the substrate."
"green",698,684,10,4.58060365123521e-10,7.71465266941035e-06,51,0.0745614035087719,0.130769230769231,390,"GO:0019866","CC","organelle inner membrane","The inner, i.e. lumen-facing, lipid bilayer of an organelle envelope; usually highly selective to most ions and metabolites."
"green",698,684,11,4.60318100490893e-10,7.75267744846762e-06,69,0.100877192982456,0.111650485436893,618,"GO:0016491","MF","oxidoreductase activity","Catalysis of an oxidation-reduction (redox) reaction, a reversible chemical reaction in which the oxidation state of an atom or atoms within a molecule is altered. One substrate acts as a hydrogen or electron donor and becomes oxidized, while the other acts as hydrogen or electron acceptor and becomes reduced."
"green",698,684,12,3.50749677101863e-09,5.90732606174958e-05,22,0.0321637426900585,0.222222222222222,99,"GO:0016627","MF","oxidoreductase activity, acting on the CH-CH group of donors","Catalysis of an oxidation-reduction (redox) reaction in which a CH-CH group acts as a hydrogen or electron donor and reduces a hydrogen or electron acceptor."
"green",698,684,13,1.02561604327134e-08,0.000172734254007759,32,0.0467836257309941,0.157635467980296,203,"GO:0005759","CC","mitochondrial matrix","The gel-like material, with considerable fine structure, that lies in the matrix space, or lumen, of a mitochondrion. It contains the enzymes of the tricarboxylic acid cycle and, in some organisms, the enzymes concerned with fatty acid oxidation."
"green",698,684,14,1.84194890589131e-08,0.000310221034730214,74,0.108187134502924,0.0993288590604027,745,"GO:0055114","BP","oxidation-reduction process","A metabolic process that results in the removal or addition of one or more electrons to or from a substance, with or without the concomitant removal or addition of a proton or protons."
"green",698,684,15,1.22641088690469e-07,0.00206552121572487,25,0.0365497076023392,0.167785234899329,149,"GO:0046395","BP","carboxylic acid catabolic process","The chemical reactions and pathways resulting in the breakdown of carboxylic acids, any organic acid containing one or more carboxyl (-COOH) groups."
"green",698,684,16,3.32603846826891e-07,0.00560171398825849,48,0.0701754385964912,0.110344827586207,435,"GO:0032787","BP","monocarboxylic acid metabolic process","The chemical reactions and pathways involving monocarboxylic acids, any organic acid containing one carboxyl (COOH) group or anion (COO-)."
"green",698,684,17,3.84562701747784e-07,0.00647680502283618,121,0.176900584795322,0.0789302022178734,1533,"GO:0031090","CC","organelle membrane","A membrane that is one of the two lipid bilayers of an organelle envelope or the outermost membrane of single membrane bound organelle."
"green",698,684,18,4.35460549026874e-07,0.00733402656671061,515,0.752923976608187,0.0573496659242762,8980,"GO:0043227","CC","membrane-bounded organelle","Organized structure of distinctive morphology and function, bounded by a single or double lipid bilayer membrane. Includes the nucleus, mitochondria, plastids, vacuoles, and vesicles. Excludes the plasma membrane."
"green",698,684,19,5.51716264594617e-07,0.00929200532830254,12,0.0175438596491228,0.292682926829268,41,"GO:0030170","MF","pyridoxal phosphate binding","Interacting selectively and non-covalently with pyridoxal 5' phosphate, 3-hydroxy-5-(hydroxymethyl)-2-methyl4-pyridine carboxaldehyde 5' phosphate, the biologically active form of vitamin B6."
"green",698,684,20,8.07011272790388e-07,0.0135916838563357,26,0.0380116959064327,0.148571428571429,175,"GO:0050662","MF","coenzyme binding","Interacting selectively and non-covalently with a coenzyme, any of various nonprotein organic cofactors that are required, in addition to an enzyme and a substrate, for an enzymatic reaction to proceed."
"greenyellow",171,170,1,0.00230548327970799,1,2,0.0117647058823529,0.333333333333333,6,"GO:0071569","BP","protein ufmylation","Covalent attachment of the ubiquitin-like protein UFM1 to another protein."
"greenyellow",171,170,2,0.00230548327970799,1,2,0.0117647058823529,0.333333333333333,6,"GO:0015288","MF","porin activity","Catalysis of the transfer of substances, sized less than 1000 Da, from one side of the membrane to the other. The transmembrane portions of porins consist exclusively of beta-strands which form a beta-barrel. They are found in the outer membranes of Gram-negative bacteria, mitochondria, plastids and possibly acid-fast Gram-positive bacteria."
"greenyellow",171,170,3,0.00320089458581767,1,2,0.0117647058823529,0.285714285714286,7,"GO:0008216","BP","spermidine metabolic process","The chemical reactions and pathways involving spermidine, N-(3-aminopropyl)-1,4-diaminobutane."
"greenyellow",171,170,4,0.00320089458581767,1,2,0.0117647058823529,0.285714285714286,7,"GO:0019673","BP","GDP-mannose metabolic process","The chemical reactions and pathways involving GDP-mannose, a substance composed of mannose in glycosidic linkage with guanosine diphosphate."
"greenyellow",171,170,5,0.00342356113070594,1,7,0.0411764705882353,0.0454545454545455,154,"GO:0000209","BP","protein polyubiquitination","Addition of multiple ubiquitin groups to a protein, forming a ubiquitin chain."
"greenyellow",171,170,6,0.00423248205640911,1,2,0.0117647058823529,0.25,8,"GO:0010388","BP","cullin deneddylation","The modification of cullins by removal of ubiquitin-like protein NEDD8 (RUB1)."
"greenyellow",171,170,7,0.00539670000846392,1,2,0.0117647058823529,0.222222222222222,9,"GO:0000338","BP","protein deneddylation","The removal of a ubiquitin-like protein of the NEDD8 type from a protein."
"greenyellow",171,170,8,0.00660683612191101,1,6,0.0352941176470588,0.0454545454545455,132,"GO:0005741","CC","mitochondrial outer membrane","The outer, i.e. cytoplasm-facing, lipid bilayer of the mitochondrial envelope."
"greenyellow",171,170,9,0.00669006973433593,1,2,0.0117647058823529,0.2,10,"GO:0012510","CC","trans-Golgi network transport vesicle membrane","The lipid bilayer surrounding a vesicle transporting substances between the trans-Golgi network and other parts of the cell."
"greenyellow",171,170,10,0.00669006973433593,1,2,0.0117647058823529,0.2,10,"GO:0004467","MF","long-chain fatty acid-CoA ligase activity","Catalysis of the reaction: ATP + a long-chain carboxylic acid + CoA = AMP + diphosphate + an acyl-CoA; a long-chain fatty acid is a fatty acid with a chain length between C13 and C22."
"greenyellow",171,170,11,0.00723871208726649,1,17,0.1,0.0243553008595989,698,"GO:0044265","BP","cellular macromolecule catabolic process","The chemical reactions and pathways resulting in the breakdown of a macromolecule, any large molecule including proteins, nucleic acids and carbohydrates, as carried out by individual cells."
"greenyellow",171,170,12,0.00775521009639934,1,9,0.0529411764705882,0.0330882352941176,272,"GO:0045666","BP","positive regulation of neuron differentiation","Any process that activates or increases the frequency, rate or extent of neuron differentiation."
"greenyellow",171,170,13,0.00810917839125018,1,2,0.0117647058823529,0.181818181818182,11,"GO:0015858","BP","nucleoside transport","The directed movement of a nucleoside, a nucleobase linked to either beta-D-ribofuranose (ribonucleoside) or 2-deoxy-beta-D-ribofuranose, (a deoxyribonucleotide), into, out of or within a cell, or between cells, by means of some agent such as a transporter or pore."
"greenyellow",171,170,14,0.00810917839125018,1,2,0.0117647058823529,0.181818181818182,11,"GO:0016486","BP","peptide hormone processing","The generation of a mature peptide hormone by posttranslational processing of a prohormone."
"greenyellow",171,170,15,0.00810917839125018,1,2,0.0117647058823529,0.181818181818182,11,"GO:0031527","CC","filopodium membrane","The portion of the plasma membrane surrounding a filopodium."
"greenyellow",171,170,16,0.00871094658487403,1,10,0.0588235294117647,0.0305810397553517,327,"GO:0004842","MF","ubiquitin-protein transferase activity","Catalysis of the transfer of ubiquitin from one protein to another via the reaction X-Ub + Y --> Y-Ub + X, where both X-Ub and Y-Ub are covalent linkages."
"greenyellow",171,170,17,0.0096506779079163,1,2,0.0117647058823529,0.166666666666667,12,"GO:0046930","CC","pore complex","Any small opening in a membrane that allows the passage of gases and/or liquids."
"greenyellow",171,170,18,0.00965964876351167,1,3,0.0176470588235294,0.0857142857142857,35,"GO:1901264","BP","carbohydrate derivative transport","The directed movement of a carbohydrate derivative into, out of or within a cell, or between cells, by means of some agent such as a transporter or pore."
"greenyellow",171,170,19,0.00994347171225636,1,6,0.0352941176470588,0.0416666666666667,144,"GO:0005802","CC","trans-Golgi network","The network of interconnected tubular and cisternal structures located within the Golgi apparatus on the side distal to the endoplasmic reticulum, from which secretory vesicles emerge. The trans-Golgi network is important in the later stages of protein secretion where it is thought to play a key role in the sorting and targeting of secreted proteins to the correct destination."
"greenyellow",171,170,20,0.00994347171225636,1,6,0.0352941176470588,0.0416666666666667,144,"GO:0031968","CC","organelle outer membrane","The outer, i.e. cytoplasm-facing in a cellular organelle, lipid bilayer of an organelle envelope."
"grey",996,964,1,4.07582238111316e-07,0.00686450005427078,13,0.0134854771784232,0.371428571428571,35,"GO:0016709","MF","oxidoreductase activity, acting on paired donors, with incorporation or reduction of molecular oxygen, NAD(P)H as one donor, and incorporation of one atom of oxygen","Catalysis of an oxidation-reduction (redox) reaction in which hydrogen or electrons are transferred from NADH or NADPH and one other donor, and one atom of oxygen is incorporated into one donor."
"grey",996,964,2,9.18705562024414e-07,0.0154728390756152,20,0.020746887966805,0.24390243902439,82,"GO:0004497","MF","monooxygenase activity","Catalysis of the incorporation of one atom from molecular oxygen into a compound and the reduction of the other atom of oxygen to water."
"grey",996,964,3,9.97038986975154e-07,0.0167921306186355,35,0.0363070539419087,0.172413793103448,203,"GO:0008202","BP","steroid metabolic process","The chemical reactions and pathways involving steroids, compounds with a 1,2,cyclopentanoperhydrophenanthrene nucleus."
"grey",996,964,4,2.55718447667749e-06,0.0430681009562023,102,0.105809128630705,0.112458654906284,907,"GO:0006629","BP","lipid metabolic process","The chemical reactions and pathways involving lipids, compounds soluble in an organic solvent but not, or sparingly, in an aqueous solvent. Includes fatty acids; neutral fats, other fatty-acid esters, and soaps; long-chain (fatty) alcohols and waxes; sphingoids and other long-chain bases; glycolipids, phospholipids and sphingolipids; and carotenes, polyprenols, sterols, terpenes and other isoprenoids."
"grey",996,964,5,7.39349243392311e-06,0.124521199572133,65,0.0674273858921162,0.124760076775432,521,"GO:0043086","BP","negative regulation of catalytic activity","Any process that stops or reduces the activity of an enzyme."
"grey",996,964,6,1.29937096631515e-05,0.218840058146798,18,0.0186721991701245,0.222222222222222,81,"GO:0020037","MF","heme binding","Interacting selectively and non-covalently with heme, any compound of iron complexed in a porphyrin (tetrapyrrole) ring."
"grey",996,964,7,1.70085084889724e-05,0.286457299971274,84,0.0871369294605809,0.113055181695828,743,"GO:0005615","CC","extracellular space","That part of a multicellular organism outside the cells proper, usually taken to be outside the plasma membranes, and occupied by fluid."
"grey",996,964,8,1.71612383448557e-05,0.28902957620406,83,0.0860995850622407,0.113387978142077,732,"GO:0044092","BP","negative regulation of molecular function","Any process that stops or reduces the rate or extent of a molecular function, an elemental biological activity occurring at the molecular level, such as catalysis or binding."
"grey",996,964,9,2.3225635354714e-05,0.391166150644093,47,0.0487551867219917,0.133903133903134,351,"GO:0051051","BP","negative regulation of transport","Any process that stops, prevents, or reduces the frequency, rate or extent of the directed movement of substances (such as macromolecules, small molecules, ions) into, out of or within a cell, or between cells, by means of some agent such as a transporter or pore."
"grey",996,964,10,2.35138034518575e-05,0.396019477736184,35,0.0363070539419087,0.150214592274678,233,"GO:0005578","CC","proteinaceous extracellular matrix","A layer consisting mainly of proteins (especially collagen) and glycosaminoglycans (mostly as proteoglycans) that forms a sheet underlying or overlying cells such as endothelial and epithelial cells. The proteins are secreted by cells in the vicinity. An example of this component is found in Mus musculus."
"grey",996,964,11,4.26849572445273e-05,0.718900049912329,18,0.0186721991701245,0.204545454545455,88,"GO:0046906","MF","tetrapyrrole binding","Interacting selectively and non-covalently with a tetrapyrrole, a compound containing four pyrrole nuclei variously substituted and linked to each other through carbons at the alpha position."
"grey",996,964,12,4.39480914724807e-05,0.74017375657952,26,0.0269709543568465,0.166666666666667,156,"GO:0004930","MF","G-protein coupled receptor activity","Combining with an extracellular signal and transmitting the signal across the membrane by activating an associated G-protein; promotes the exchange of GDP for GTP on the alpha subunit of a heterotrimeric G-protein complex."
"grey",996,964,13,6.49240880680025e-05,1,38,0.0394190871369295,0.138686131386861,274,"GO:0031012","CC","extracellular matrix","A structure lying external to one or more cells, which provides structural support for cells or tissues; may be completely external to the cell (as in animals and bacteria) or be part of the cell (as in plants)."
"grey",996,964,14,6.79634578757884e-05,1,18,0.0186721991701245,0.197802197802198,91,"GO:0043271","BP","negative regulation of ion transport","Any process that stops, prevents, or reduces the frequency, rate or extent of the directed movement of charged atoms or small charged molecules into, out of or within a cell, or between cells, by means of some agent such as a transporter or pore."
"grey",996,964,15,6.91199276681205e-05,1,77,0.0798755186721992,0.111111111111111,693,"GO:0044255","BP","cellular lipid metabolic process","The chemical reactions and pathways involving lipids, as carried out by individual cells."
"grey",996,964,16,7.30526865853226e-05,1,20,0.020746887966805,0.185185185185185,108,"GO:0006694","BP","steroid biosynthetic process","The chemical reactions and pathways resulting in the formation of steroids, compounds with a 1,2,cyclopentanoperhydrophenanthrene nucleus; includes de novo formation and steroid interconversion by modification."
"grey",996,964,17,7.65132155360541e-05,1,25,0.0259336099585062,0.164473684210526,152,"GO:0016705","MF","oxidoreductase activity, acting on paired donors, with incorporation or reduction of molecular oxygen","Catalysis of an oxidation-reduction (redox) reaction in which hydrogen or electrons are transferred from each of two donors, and molecular oxygen is reduced or incorporated into a donor."
