"module","modSize","bkgrModSize","rank","enrichmentP","BonferoniP","nModGenesInTerm","fracOfBkgrModSize","fracOfBkgrTermSize","bkgrTermSize","termID","termOntology","termName","termDefinition"
"grey",996,964,18,7.65958824454403e-05,1,19,0.0197095435684647,0.19,100,"GO:0016125","BP","sterol metabolic process","The chemical reactions and pathways involving sterols, steroids with one or more hydroxyl groups and a hydrocarbon side-chain in the molecule."
"grey",996,964,19,8.48341637729752e-05,1,6,0.00622406639004149,0.5,12,"GO:0004984","MF","olfactory receptor activity","Combining with an odorant and transmitting the signal from one side of the membrane to the other to initiate a change in cell activity in response to detection of smell."
"grey",996,964,20,9.64088753771107e-05,1,53,0.0549792531120332,0.12183908045977,435,"GO:0032787","BP","monocarboxylic acid metabolic process","The chemical reactions and pathways involving monocarboxylic acids, any organic acid containing one carboxyl (COOH) group or anion (COO-)."
"grey60",119,117,1,1.41072805500173e-08,0.000237594819023392,14,0.11965811965812,0.0600858369098712,233,"GO:0005578","CC","proteinaceous extracellular matrix","A layer consisting mainly of proteins (especially collagen) and glycosaminoglycans (mostly as proteoglycans) that forms a sheet underlying or overlying cells such as endothelial and epithelial cells. The proteins are secreted by cells in the vicinity. An example of this component is found in Mus musculus."
"grey60",119,117,2,1.07736504279769e-07,0.00181449820507987,14,0.11965811965812,0.0510948905109489,274,"GO:0031012","CC","extracellular matrix","A structure lying external to one or more cells, which provides structural support for cells or tissues; may be completely external to the cell (as in animals and bacteria) or be part of the cell (as in plants)."
"grey60",119,117,3,2.00291828128848e-06,0.0337331496934606,10,0.0854700854700855,0.0595238095238095,168,"GO:0030246","MF","carbohydrate binding","Interacting selectively and non-covalently with any carbohydrate, which includes monosaccharides, oligosaccharides and polysaccharides as well as substances derived from monosaccharides by reduction of the carbonyl group (alditols), by oxidation of one or more hydroxy groups to afford the corresponding aldehydes, ketones, or carboxylic acids, or by replacement of one or more hydroxy group(s) by a hydrogen atom. Cyclitols are generally not regarded as carbohydrates."
"grey60",119,117,4,0.000157546160217538,1,5,0.0427350427350427,0.0847457627118644,59,"GO:0005581","CC","collagen trimer","A protein complex consisting of three collagen chains assembled into a left-handed triple helix. These trimers typically assemble into higher order structures."
"grey60",119,117,5,0.000223937830439939,1,2,0.0170940170940171,0.666666666666667,3,"GO:1903966","BP","monounsaturated fatty acid biosynthetic process","The chemical reactions and pathways resulting in the formation of monounsaturated fatty acid."
"grey60",119,117,6,0.000223937830439939,1,2,0.0170940170940171,0.666666666666667,3,"GO:0008184","MF","glycogen phosphorylase activity","Catalysis of the reaction: glycogen + phosphate = maltodextrin + alpha-D-glucose 1-phosphate."
"grey60",119,117,7,0.000223937830439939,1,2,0.0170940170940171,0.666666666666667,3,"GO:0032896","MF","palmitoyl-CoA 9-desaturase activity","Catalysis of the reaction: palmitoyl-CoA + AH2 + O2 = palmitoleic acid (16:1delta9) + A + 2 H2O."
"grey60",119,117,8,0.000299233153230625,1,42,0.358974358974359,0.0143835616438356,2920,"GO:0005576","CC","extracellular region","The space external to the outermost structure of a cell. For cells without external protective or external encapsulating structures this refers to space outside of the plasma membrane. This term covers the host cell environment outside an intracellular parasite."
"grey60",119,117,9,0.000445323263738208,1,2,0.0170940170940171,0.5,4,"GO:0005610","CC","laminin-5 complex","A laminin complex composed of alpha3, beta3 and gamma2 polypeptide chains."
"grey60",119,117,10,0.000562044194110556,1,3,0.0256410256410256,0.157894736842105,19,"GO:0008209","BP","androgen metabolic process","The chemical reactions and pathways involving androgens, C19 steroid hormones that can stimulate the development of male sexual characteristics."
"grey60",119,117,11,0.000657048011027079,1,3,0.0256410256410256,0.15,20,"GO:0005605","CC","basal lamina","A thin sheet of proteoglycans and glycoproteins, especially laminin, secreted by cells as an extracellular matrix."
"grey60",119,117,12,0.000692336010043491,1,16,0.136752136752137,0.0215343203230148,743,"GO:0005615","CC","extracellular space","That part of a multicellular organism outside the cells proper, usually taken to be outside the plasma membranes, and occupied by fluid."
"grey60",119,117,13,0.000737978490595919,1,2,0.0170940170940171,0.4,5,"GO:0072174","BP","metanephric tubule formation","The developmental process pertaining to the initial formation of a metanephric tubule."
"grey60",119,117,14,0.000737978490595919,1,2,0.0170940170940171,0.4,5,"GO:0036156","CC","inner dynein arm","Inner arm structure present on the outer doublet microtubules of ciliary and flagellar axonemes. The structure of inner dynein arms is complex and may vary within the axoneme. Inner dynein arms are heteromeric, comprising 8 different heavy chains and various subunits. Inner and outer dynein arms have different functions in the generation of microtubule-based motility."
"grey60",119,117,15,0.000737978490595919,1,2,0.0170940170940171,0.4,5,"GO:0004645","MF","phosphorylase activity","Catalysis of the reaction: 1,4-alpha-D-glucosyl(n) + phosphate = 1,4-alpha-D-glucosyl(n-1) + alpha-D-glucose 1-phosphate. The name should be qualified in each instance by adding the name of the natural substrate, e.g. maltodextrin phosphorylase, starch phosphorylase, glycogen phosphorylase."
"grey60",119,117,16,0.00110066760906793,1,2,0.0170940170940171,0.333333333333333,6,"GO:0072173","BP","metanephric tubule morphogenesis","The process in which the anatomical structures of a metanephric tubule are generated and organized from an epithelium. A metanephric tubule is an epithelial tube that is part of the metanephros."
"grey60",119,117,17,0.00110066760906793,1,2,0.0170940170940171,0.333333333333333,6,"GO:0005587","CC","collagen type IV trimer","A collagen heterotrimer containing type IV alpha chains; [alpha1(IV)]2alpha2(IV) trimers are commonly observed, although more type IV alpha chains exist and may be present in type IV trimers; type IV collagen triple helices associate to form 3 dimensional nets within basement membranes."
"grey60",119,117,18,0.00123259968926273,1,5,0.0427350427350427,0.0543478260869565,92,"GO:0030879","BP","mammary gland development","The process whose specific outcome is the progression of the mammary gland over time, from its formation to the mature structure. The mammary gland is a large compound sebaceous gland that in female mammals is modified to secrete milk. Its development starts with the formation of the mammary line and ends as the mature gland cycles between nursing and weaning stages."
"grey60",119,117,19,0.00123259968926273,1,5,0.0427350427350427,0.0543478260869565,92,"GO:0005604","CC","basement membrane","A thin layer of dense material found in various animal tissues interposed between the cells and the adjacent connective tissue. It consists of the basal lamina plus an associated layer of reticulin fibers."
"grey60",119,117,20,0.00174298065168764,1,39,0.333333333333333,0.0135793871866295,2872,"GO:0071944","CC","cell periphery","The part of a cell encompassing the cell cortex, the plasma membrane, and any external encapsulating structures."
"lightcyan",125,120,1,1.03111900701765e-24,1.73661063161912e-20,33,0.275,0.092436974789916,357,"GO:0045087","BP","innate immune response","Innate immune responses are defense responses mediated by germline encoded components that directly recognize components of potential pathogens."
"lightcyan",125,120,2,2.49889022251751e-22,4.20863091276398e-18,42,0.35,0.0537084398976982,782,"GO:0006952","BP","defense response","Reactions, triggered in response to the presence of a foreign body or the occurrence of an injury, which result in restriction of damage to the organism attacked or prevention/recovery from the infection caused by the attack."
"lightcyan",125,120,3,1.35971323578459e-21,2.2900290317084e-17,39,0.325,0.0571010248901903,683,"GO:0006955","BP","immune response","Any immune system process that functions in the calibrated response of an organism to a potential internal or invasive threat."
"lightcyan",125,120,4,9.96909037520535e-19,1.67899420099209e-14,50,0.416666666666667,0.0350140056022409,1428,"GO:0002376","BP","immune system process","Any process involved in the development or functioning of the immune system, an organismal system for calibrated responses to potential internal or invasive threats."
"lightcyan",125,120,5,2.38476689359763e-17,4.01642440219712e-13,30,0.25,0.0612244897959184,490,"GO:0002684","BP","positive regulation of immune system process","Any process that activates or increases the frequency, rate, or extent of an immune system process."
"lightcyan",125,120,6,4.98921516606997e-16,8.40283618269505e-12,35,0.291666666666667,0.0449293966623877,779,"GO:0002682","BP","regulation of immune system process","Any process that modulates the frequency, rate, or extent of an immune system process."
"lightcyan",125,120,7,7.08651344089846e-13,1.19351059371612e-08,20,0.166666666666667,0.0704225352112676,284,"GO:0050778","BP","positive regulation of immune response","Any process that activates or increases the frequency, rate or extent of the immune response, the immunological reaction of an organism to an immunogenic stimulus."
"lightcyan",125,120,8,9.26095779141575e-13,1.55973051123024e-08,22,0.183333333333333,0.0606060606060606,363,"GO:0050776","BP","regulation of immune response","Any process that modulates the frequency, rate or extent of the immune response, the immunological reaction of an organism to an immunogenic stimulus."
"lightcyan",125,120,9,3.32395067627532e-12,5.59819772898289e-08,22,0.183333333333333,0.0568475452196382,387,"GO:0034097","BP","response to cytokine","Any process that results in a change in state or activity of a cell or an organism (in terms of movement, secretion, enzyme production, gene expression, etc.) as a result of a cytokine stimulus."
"lightcyan",125,120,10,1.4310325666693e-10,2.41014504878444e-06,15,0.125,0.0785340314136126,191,"GO:0002253","BP","activation of immune response","Any process that initiates an immune response."
"lightcyan",125,120,11,1.55662174112618e-10,2.62166233640472e-06,50,0.416666666666667,0.0218340611353712,2290,"GO:0006950","BP","response to stress","Any process that results in a change in state or activity of a cell or an organism (in terms of movement, secretion, enzyme production, gene expression, etc.) as a result of a disturbance in organismal or cellular homeostasis, usually, but not necessarily, exogenous (e.g. temperature, humidity, ionizing radiation)."
"lightcyan",125,120,12,3.15289414383506e-10,5.31010431704701e-06,15,0.125,0.0742574257425743,202,"GO:0002250","BP","adaptive immune response","An immune response based on directed amplification of specific receptors for antigen produced through a somatic diversification process, and allowing for enhanced response to subsequent exposures to the same antigen (immunological memory)."
"lightcyan",125,120,13,3.54395475125828e-10,5.96872859206919e-06,10,0.0833333333333333,0.149253731343284,67,"GO:0019724","BP","B cell mediated immunity","Any process involved with the carrying out of an immune response by a B cell, through, for instance, the production of antibodies or cytokines, or antigen presentation to T cells."
"lightcyan",125,120,14,6.00089569339181e-10,1.01067085268105e-05,13,0.108333333333333,0.0884353741496599,147,"GO:0045088","BP","regulation of innate immune response","Any process that modulates the frequency, rate or extent of the innate immune response, the organism's first line of defense against infection."
"lightcyan",125,120,15,7.26470111770023e-10,1.22352096224307e-05,6,0.05,0.461538461538462,13,"GO:0002495","BP","antigen processing and presentation of peptide antigen via MHC class II","The process in which an antigen-presenting cell expresses a peptide antigen on its cell surface in association with an MHC class II protein complex. The peptide antigen is typically, but not always, processed from a whole protein."
"lightcyan",125,120,16,7.49700705031016e-10,1.26264592741324e-05,21,0.175,0.0452586206896552,464,"GO:0051707","BP","response to other organism","Any process that results in a change in state or activity of a cell or an organism (in terms of movement, secretion, enzyme production, gene expression, etc.) as a result of a stimulus from another living organism."
"lightcyan",125,120,17,7.63058495732489e-10,1.28514311851266e-05,17,0.141666666666667,0.0586206896551724,290,"GO:0098542","BP","defense response to other organism","Reactions triggered in response to the presence of another organism that act to protect the cell or organism from damage caused by that organism."
"lightcyan",125,120,18,8.64928553697249e-10,1.45671267013691e-05,14,0.116666666666667,0.0765027322404372,183,"GO:0002443","BP","leukocyte mediated immunity","Any process involved in the carrying out of an immune response by a leukocyte."
"lightcyan",125,120,19,1.07799348617627e-09,1.81555662941808e-05,5,0.0416666666666667,0.714285714285714,7,"GO:0042613","CC","MHC class II protein complex","A transmembrane protein complex composed of an MHC class II alpha and MHC class II beta chain, and with or without a bound peptide or polysaccharide antigen."
"lightcyan",125,120,20,1.26208537396358e-09,2.12560418682946e-05,6,0.05,0.428571428571429,14,"GO:0002504","BP","antigen processing and presentation of peptide or polysaccharide antigen via MHC class II","The process in which an antigen-presenting cell expresses antigen (peptide or polysaccharide) on its cell surface in association with an MHC class II protein complex."
"lightgreen",96,96,1,1.31166134261695e-06,0.0220910003323546,17,0.177083333333333,0.027823240589198,611,"GO:0022857","MF","transmembrane transporter activity","Enables the transfer of a substance from one side of a membrane to the other."
"lightgreen",96,96,2,5.94791020920805e-06,0.100174703743482,14,0.145833333333333,0.029723991507431,471,"GO:0008289","MF","lipid binding","Interacting selectively and non-covalently with a lipid."
"lightgreen",96,96,3,1.04188544467568e-05,0.175474346592278,18,0.1875,0.02275600505689,791,"GO:0005215","MF","transporter activity","Enables the directed movement of substances (such as macromolecules, small molecules, ions) into, out of or within a cell, or between cells."
"lightgreen",96,96,4,1.81622709931969e-05,0.305888968067422,5,0.0520833333333333,0.108695652173913,46,"GO:0009410","BP","response to xenobiotic stimulus","Any process that results in a change in state or activity of a cell or an organism (in terms of movement, secretion, enzyme production, gene expression, etc.) as a result of a xenobiotic compound stimulus. Xenobiotic compounds are compounds foreign to living organisms."
"lightgreen",96,96,5,5.04476482019977e-05,0.849639291018045,2,0.0208333333333333,1,2,"GO:1902861","BP","copper ion import into cell","The directed movement of copper ions from outside of a cell into the cytoplasmic compartment. This may occur via transport across the plasma membrane or via endocytosis."
"lightgreen",96,96,6,7.64975165027615e-05,1,48,0.5,0.011508031647087,4171,"GO:0043167","MF","ion binding","Interacting selectively and non-covalently with ions, charged atoms or groups of atoms."
"lightgreen",96,96,7,9.602051011692e-05,1,4,0.0416666666666667,0.117647058823529,34,"GO:0006778","BP","porphyrin-containing compound metabolic process","The chemical reactions and pathways involving any member of a large group of derivatives or analogs of porphyrin. Porphyrins consists of a ring of four pyrrole nuclei linked each to the next at their alpha positions through a methine group."
"lightgreen",96,96,8,0.000114605963919937,1,7,0.0729166666666667,0.0454545454545455,154,"GO:0031406","MF","carboxylic acid binding","Interacting selectively and non-covalently with a carboxylic acid, any organic acid containing one or more carboxyl (COOH) groups or anions (COO-)."
"lightgreen",96,96,9,0.000124220779821124,1,7,0.0729166666666667,0.0448717948717949,156,"GO:0043177","MF","organic acid binding","Interacting selectively and non-covalently with an organic acid, any acidic compound containing carbon in covalent linkage."
"lightgreen",96,96,10,0.000134522726601137,1,4,0.0416666666666667,0.108108108108108,37,"GO:0006805","BP","xenobiotic metabolic process","The chemical reactions and pathways involving a xenobiotic compound, a compound foreign to living organisms. Used of chemical compounds, e.g. a xenobiotic chemical, such as a pesticide."
"lightgreen",96,96,11,0.000150637488055712,1,2,0.0208333333333333,0.666666666666667,3,"GO:0009804","BP","coumarin metabolic process","The chemical reactions and pathways involving coumarins, compounds derived from the phenylacrylic skeleton of cinnamic acids."
"lightgreen",96,96,12,0.000161049340951309,1,13,0.135416666666667,0.0232974910394265,558,"GO:0022891","MF","substrate-specific transmembrane transporter activity","Enables the transfer of a specific substance or group of related substances from one side of a membrane to the other."
"lightgreen",96,96,13,0.000187075205356218,1,6,0.0625,0.0512820512820513,117,"GO:0005506","MF","iron ion binding","Interacting selectively and non-covalently with iron (Fe) ions."
"lightgreen",96,96,14,0.00020181610924737,1,4,0.0416666666666667,0.0975609756097561,41,"GO:0071466","BP","cellular response to xenobiotic stimulus","Any process that results in a change in state or activity of a cell (in terms of movement, secretion, enzyme production, gene expression, etc.) as a result of a xenobiotic compound stimulus. Xenobiotic compounds are compounds foreign to living organisms."
"lightgreen",96,96,15,0.000212813299613974,1,9,0.09375,0.03125,288,"GO:0051186","BP","cofactor metabolic process","The chemical reactions and pathways involving a cofactor, a substance that is required for the activity of an enzyme or other protein. Cofactors may be inorganic, such as the metal atoms zinc, iron, and copper in certain forms, or organic, in which case they are referred to as coenzymes. Cofactors may either be bound tightly to active sites or bind loosely with the substrate."
"lightgreen",96,96,16,0.000261184708859877,1,15,0.15625,0.02,750,"GO:0006082","BP","organic acid metabolic process","The chemical reactions and pathways involving organic acids, any acidic compound containing carbon in covalent linkage."
"lightgreen",96,96,17,0.000265893046263386,1,11,0.114583333333333,0.0252873563218391,435,"GO:0032787","BP","monocarboxylic acid metabolic process","The chemical reactions and pathways involving monocarboxylic acids, any organic acid containing one carboxyl (COOH) group or anion (COO-)."
"lightgreen",96,96,18,0.000299871383637863,1,2,0.0208333333333333,0.5,4,"GO:0006166","BP","purine ribonucleoside salvage","Any process which produces a purine nucleoside from derivatives of it, without de novo synthesis."
"lightgreen",96,96,19,0.000359077133265452,1,14,0.145833333333333,0.0203488372093023,688,"GO:0019752","BP","carboxylic acid metabolic process","The chemical reactions and pathways involving carboxylic acids, any organic acid containing one or more carboxyl (COOH) groups or anions (COO-)."
"lightgreen",96,96,20,0.000427293726404816,1,3,0.03125,0.142857142857143,21,"GO:0006783","BP","heme biosynthetic process","The chemical reactions and pathways resulting in the formation of heme, any compound of iron complexed in a porphyrin (tetrapyrrole) ring, from less complex precursors."
"lightyellow",84,84,1,3.85658994807377e-05,0.649526879054584,2,0.0238095238095238,1,2,"GO:0035470","BP","positive regulation of vascular wound healing","Any process that increases the rate, frequency, or extent of blood vessel formation when new vessels emerge from the proliferation of pre-existing blood vessels and contribute to the series of events that restore integrity to damaged vasculature."
"lightyellow",84,84,2,3.85658994807377e-05,0.649526879054584,2,0.0238095238095238,1,2,"GO:0045977","BP","positive regulation of mitotic cell cycle, embryonic","Any process that activates or increases the frequency, rate or extent of progression through the embryonic mitotic cell cycle."
"lightyellow",84,84,3,3.85658994807377e-05,0.649526879054584,2,0.0238095238095238,1,2,"GO:0072144","BP","glomerular mesangial cell development","The process whose specific outcome is the progression of a glomerular mesangial cell in the kidney over time, from its formation to the mature structure."
"lightyellow",84,84,4,0.000115227242661579,1,2,0.0238095238095238,0.666666666666667,3,"GO:0072143","BP","mesangial cell development","The process whose specific outcome is the progression of a mesangial cell in the kidney over time, from its formation to the mature structure."
"lightyellow",84,84,5,0.000115227242661579,1,2,0.0238095238095238,0.666666666666667,3,"GO:1904238","BP","pericyte cell differentiation","The process in which a relatively unspecialized cell acquires the specialized features of a pericyte cell."
"lightyellow",84,84,6,0.000229517825817039,1,2,0.0238095238095238,0.5,4,"GO:0030242","BP","pexophagy","The process in which peroxisomes are delivered to the vacuole and degraded in response to changing nutrient conditions."
"lightyellow",84,84,7,0.000288408042424137,1,3,0.0357142857142857,0.142857142857143,21,"GO:0043536","BP","positive regulation of blood vessel endothelial cell migration","Any process that activates or increases the frequency, rate or extent of the migration of the endothelial cells of blood vessels."
"lightyellow",84,84,8,0.000380975663535328,1,2,0.0238095238095238,0.4,5,"GO:0009794","BP","regulation of mitotic cell cycle, embryonic","Any process that modulates the frequency, rate or extent of replication and segregation of genetic material in the embryo."
"lightyellow",84,84,9,0.000380975663535328,1,2,0.0238095238095238,0.4,5,"GO:0061042","BP","vascular wound healing","Blood vessel formation when new vessels emerge from the proliferation of pre-existing blood vessels and contribute to the series of events that restore integrity to damaged vasculature."
"lightyellow",84,84,10,0.000569142955224807,1,2,0.0238095238095238,0.333333333333333,6,"GO:0090050","BP","positive regulation of cell migration involved in sprouting angiogenesis","Any process that increases the frequency, rate or extent of cell migration involved in sprouting angiogenesis. Cell migration involved in sprouting angiogenesis is the orderly movement of endothelial cells into the extracellular matrix in order to form new blood vessels contributing to the process of sprouting angiogenesis."
"lightyellow",84,84,11,0.000689068855112573,1,9,0.107142857142857,0.0231958762886598,388,"GO:0030855","BP","epithelial cell differentiation","The process in which a relatively unspecialized cell acquires specialized features of an epithelial cell, any of the cells making up an epithelium."
"lightyellow",84,84,12,0.000881325194295554,1,6,0.0714285714285714,0.0335195530726257,179,"GO:0090287","BP","regulation of cellular response to growth factor stimulus","Any process that modulates the rate, frequency, or extent of a change in state or activity of a cell (in terms of movement, secretion, enzyme production, gene expression, etc.) as a result of a growth factor stimulus."
"lightyellow",84,84,13,0.00102358339750493,1,3,0.0357142857142857,0.09375,32,"GO:0007031","BP","peroxisome organization","A process that is carried out at the cellular level which results in the assembly, arrangement of constituent parts, or disassembly of a peroxisome. A peroxisome is a small, membrane-bounded organelle that uses dioxygen (O2) to oxidize organic molecules."
"lightyellow",84,84,14,0.00112089020807935,1,3,0.0357142857142857,0.0909090909090909,33,"GO:0045668","BP","negative regulation of osteoblast differentiation","Any process that stops, prevents, or reduces the frequency, rate or extent of osteoblast differentiation."
"lightyellow",84,84,15,0.00122384933813152,1,3,0.0357142857142857,0.0882352941176471,34,"GO:0090303","BP","positive regulation of wound healing","Any process that increases the rate, frequency, or extent of the series of events that restore integrity to a damaged tissue, following an injury."
"lightyellow",84,84,16,0.0013493856240206,1,2,0.0238095238095238,0.222222222222222,9,"GO:0072148","BP","epithelial cell fate commitment","The process in which the developmental fate of a cell becomes restricted such that it will develop into an epithelial cell."
"lightyellow",84,84,17,0.00165412032247998,1,5,0.0595238095238095,0.0364963503649635,137,"GO:0045165","BP","cell fate commitment","The commitment of cells to specific cell fates and their capacity to differentiate into particular kinds of cells. Positional information is established through protein signals that emanate from a localized source within a cell (the initial one-cell zygote) or within a developmental field."
"lightyellow",84,84,18,0.00167989526354459,1,2,0.0238095238095238,0.2,10,"GO:0060055","BP","angiogenesis involved in wound healing","Blood vessel formation when new vessels emerge from the proliferation of pre-existing blood vessels and contribute to the series of events that restore integrity to a damaged tissue, following an injury."
